Date,SentimentScore,Sentiment,SentimentNum,StarRating,Rating,Review
9/19/13,0.355137845,Positive,0,5.0 star rating,5,"Went to Black & Gold for the first time early this year, and have come back consistently every two weeks since. They're that good. Since coming here I've never thought about going anywhere else. Every time I get a cut it's flawless work by Mark. He's my go-to-guy for a cut. No matter where I am in the bay, I'd commute FAR to get a cut from him. I got some difficult ass hair to work with, I always need it a certain way, and I've been to my fair share of barber shops around the bay, but let me tell you, Mark is the best by FAR. Every cut I get from him, I don't even need to worry anymore because it always comes out flawless and exactly how I ask. Whatever you need whether it's a faux hawk, taper, fade, combover, etc, he will NOT disappoint. Moreover, he has great customer service, and will always make the effort to accommodate you to your own convenience. I will continue to get my haircut from Mark as long as I'm in the bay, and I don't plan on moving anywhere any time soon. I give the highest recommendation for him, primarily because if he's kept lowkey, it'd just be an insult to his skill."
3/30/16,0.185648148,Positive,0,5.0 star rating,5,Very professional! Make sure you call before to get an appt. they dont have times for walk ins. My Barber was Sam and he was super cool as well as the other barbers. Sam makes sure you are satisfied with his work and his line ups are on point. You will mot be disappointed getting a haircut here. Thanks Sam.
4/8/15,0.570595238,Positive,0,5.0 star rating,5,"This barbershop is one of the best around in the Bay Area. Everyone is super friendly, the vibe and environment is great, all the barbers are cool and great at what they do. This shop is usually very busy so you should always make an appointment. I always have a great experience here. I go to Victor Salvador here at B&G. I recommend booking an appointment with him. He always tries to find time to fit you in his schedule and always takes care of his clients. He does a great job on my hair and does everything I want. He's great on all kinds of haircuts and will take time on your hair to make sure he did his best job. He will not disappoint you!!!"
7/19/14,-0.173313492,Negative,1,1.0 star rating,1,"Worst experience of my life! mind you I go to a barbershop every single week but my barbers out of town. So I have two of my cousins that came in from Mexico and they've never been to a barbershop so I decide to make them an appointment black and gold with the barber SAM. HUGE mistake. When arriving to the appointment. Sam said  ""they're mother called to cancel"" WTF!? Not only Sam made up some ridiculous excuse to not comply with his clients but his approach to this was childish and unprofessional. To all of those that need a barber. I suggest going to Super Cuts instead Sam of Black & Gold. Waste of my time."
3/19/15,0.29537037,Positive,0,5.0 star rating,5,"Clean barber shop in Daly City with a nice vibe. all the barbers are friendly and the shop is the best I've been to in the area. Coming from Los Angeles it took me forever to find a good barber who can cut African American hair but I was recommended to VIC and haven't gone to anyone else since then. His tapers, fades and line ups are clean and as picky as I am I never leave disappointed."
5/14/15,0.475,Positive,0,5.0 star rating,5,Me and my son have been getting cut from Rod for many years he's great with kids. Whatever cut I want Rod can do it and he's on point with my beard he can get busy so make sure you get a appointment. black&gold
4/12/15,0.227916667,Positive,0,5.0 star rating,5,"This shop is very professional and my barber Vick is very talented, he interacts with his clients and is very reliable. I highly recommend Vick as a barber and professsion, and Black and Gold!!"
5/1/13,0.135416667,Positive,0,5.0 star rating,5,"Stopped by to get a hair cut and had the best haircut experience that I've had in a long time. Saturday morning I went to get my hair cut midday. Firstly, the Giants game was on! I always feel like getting my haircut is a chore, but no more. Secondly, everyone is laid back and hella nice. Lastly, I got a clean haircut. The best I've had in a long time. THANKS HUBERT!I will definitely get my hair cut again by Hubert, likely during a ball game."
7/25/14,0.121562049,Positive,0,5.0 star rating,5,"Black & Gold Barber Lounge is my new barbershop.A skilled, professional and consistent barber who knows how to cut African American hair is, at least for me, so difficult to find in the SF bay area (unless you are willing to travel to the east  or south bay). After I viewed some head shots on Yelp at Black and Gold Barber Lounge my interest was peaked.  So, I scheduled an appointment  with Sam for a hair cut and beard trim. The appointment was schedule during my lunch hour. So I was hoping it would be precise and quick.Once I arrived at t Black and Gold Barber Lounge, I was impressed. The shop was bright, with large windows and natural light. Most important, I was clean as well decorated. Yes, this stuff matters, at least for me. I also noticed the other barbers cutting other clients, including two other African Americans and their hair cuts looked great too!Sam, the barber, got to me at my scheduled appointment time. Again, impressed. Sam has mad skills. He hooked me up right!. Same provided neat, clean and precise temple tapered cut and razor lined my sides and beard. I was very satisfied with his services. Sam gets my personal 5 star rating. Thanks Sam! The only reason I did not rate Black and Gold Barber Lounge with 5 stars is because I noticed one of the barbers who was cutting a client's hair was either texting or answering his phone. This is a major annoyance for me. It usually increases the time the client has to be in the barber's chair, which is not a win-win for the client or barber.  Hopefully, the management will address this issue.Great first impression and fantastic hair cut, lining and bread trim. I'll be a returning client at Black and Gold Barber Lounge."
5/18/13,0.240909091,Positive,0,5.0 star rating,5,"I think I've finally found my barber shop!If you live in the City and don't mind traveling a few mins to Daly City, then this place is worth it (Plus, they KNOW how to cut a brotha's hair).Get a cut with Hubert.. He's a consummate pro (and an all round good dude too)"
11/12/14,0.01,Positive,0,5.0 star rating,5,My husband and youngest son went in for a cut a few weeks ago. I think we found a spot they can keep going back to. Showed Mark a picture of what I wanted my youngest son to get and he did the job! Thanks again! They'll definitely be coming back!
12/20/13,0.068386243,Positive,0,2.0 star rating,2,"Decent place to get a haircut ONLY for younger guys with hip hop style. The people here find hanging out and smoking hookah vaporizer is more important than actually running a business. Now down to the specifics. I have been there 3 times hoping that I had found my ""go to"" Barbershop but after my most recent visit will certainly be my last. Why? Because:1) set an appointment for a specific time and still had to wait 20 minutes before getting cut. There's a reason why people set up appointments and these guys don't get that2)  my barber stopped cutting my hair to go and take shots in the back room! Are you kidding me? 3) no people skills. The people that talk to each other are the ones who go there everyday. Good luck having a conversation with one of them if you're not a regular.4) no haircut skills. Being decent with clippers is one thing but put scissors in their hands and its a whole nother ball game for these guys. Bottom line:  good haircuts are an afterthought to this place. Look elsewhere for barbers who take their craft seriously!"
4/7/15,0.097222222,Positive,0,1.0 star rating,1,Made an appointment and dude didn't show. No call and they took my number down. I took off work and have been looking for a barber since moving from the east bay. Seemed like a cool place but have things to figure out.
1/1/16,0.217638889,Positive,0,5.0 star rating,5,"Best hair cut of my life by Vic. Will be going back whenever I'm in town. You need an appointment to get your hair done and it a little pricey, but the quality is top notch. Would highly recommend Black & Gold for people with ethnic hair."
7/14/14,0.318666667,Positive,0,5.0 star rating,5,My dude mark always comes thru for me. Last time he hooked me up real nice for my wedding. My wife always loves how my cut comes out after I go to black and gold. Highly recommended to anyone looking for a good cut and chill atmosphere.
8/2/14,0.386111111,Positive,0,5.0 star rating,5,The best fades in town! I come here every week and see Mark for a good quality cut. Mark is a solid guy and down to earth. Hit him up for an appointment.
1/20/12,0.375757576,Positive,0,5.0 star rating,5,"I obviously normally don't yelp (can you tell?) but felt that this one was a must...I've been a customer of Derrick's for about 5-6 years now and can't imagine being cut by anyone else.  If I could give it 6 stars, I would.  Derrick makes sure that you're happy with the results and will remember exactly how to cut you the next time you go back.  I'm a bit OCD with my haircuts, so it says a lot that I've been 100% happy with my cut every time.  And I go every week.His new location/shop has a welcoming and elegant vibe to it.  It's definitely above and being what you would normally expect from a normal barber shop and is deserving of it's name ""Lounge"".  I guess that makes sense since it isn't just ANY barber shop.  If you want to get a great quality haircut with great service, this is the place to go."
10/9/13,0.441666667,Positive,0,5.0 star rating,5,Black and gold is one of the best places to get a hair cut in the entire Bay Area.  Staff are friendly and give some of the best cuts I've seen.  I always go to Mark and I'm going to continue doing so!
3/4/12,0.247188228,Positive,0,5.0 star rating,5,"This might sound biased because I've known Derrick for years...but this is probably the nicest and cleanest barbershop in the Bay. Everything is brand new from the floors to the chairs..it's truly a REAL barbershop!! Coming from the east coast it was hard to find barbershops like those back home because most of the shops here are small and kind of the hole in the wall type! But B & G reminds me of the shops on the east coast, nice leather couches, TV and drinks available. Plenty of room to kick back while you wait for a cut.Just a heads up...make sure you book an appointment with either Derrick or Rodney cause they are busy all the time!!"
8/9/15,0.399074074,Positive,0,5.0 star rating,5,"I always get my haircut from Vic and he does a great job. Overall this is a great place for anyone who wants a fresh clean cut. Everyone is welcoming, friendly and also funny. I would recommend this place to anyone but make sure you book an appointment ahead of time because they're always booked."
10/6/14,0.321875,Positive,0,5.0 star rating,5,Had a barber from another barbershop mess up my hair and came in and had Mark do a major repair job in which he hooked me up with a fantastic fade. Very happy with results - mark's the man.
7/30/15,0.395833333,Positive,0,5.0 star rating,5,"My dude Vic always does a super clean job! He's my go to guy whenever I need a cut,"
4/15/14,0.243194444,Positive,0,5.0 star rating,5,Black and Gold is definitely highly recommended.  Every barber there is friendly and the entire place is very welcoming.  Mark is my go to barber every 2-3 weeks now.  He's got skills with the bald fade and beard lineups.  I even bring my 12 year old nephew who loves getting his haircut now.  Every barber there has skills though and it doesn't take long to notice.  They put time into every client and the proof is in the pics on Yelp. They have a by appointment only system which works great.  You never have to wait that way and it allows them to make sure you aren't rushed.  I've been to several barbers in SF and surrounding areas and this one ranks the best in my opinion.
10/17/14,0.242121212,Positive,0,5.0 star rating,5,Went in on Tuesday to get my haircut after 2 years of growing it out. I was referred to Mark by a friend and I am very happy with the results. He was very professional but also a really cool dude. Understood exactly what I was looking to get and even suggested a few improvements that really made the haircut worth the $25. The shop is very well kept and the location is nice as well. Will definitely be recommending Black and Gold to my friends.
2/27/14,-0.069444444,Negative,1,5.0 star rating,5,"Black & Gold is the go-to spot for all your trendy/urban haircut needs. They never fail to deliver unlike UPS from across the street... I come here to see Mark every time I need to get faded (minus the alcohol), but you can't really go wrong with anyone at this shop. All the barbers got BARS and got their clipper game on lock. Be sure to call ahead to schedule an appointment."
1/18/14,0.21875,Positive,0,5.0 star rating,5,My boyfriend comes out of this barber shop looking sharp. This place is kid friendly and the barbers are really friendly. Rodney and Mark know exactly what they are doing. I recommend anyone looking for a barber to come here.
9/14/13,0.75,Positive,0,5.0 star rating,5,Just went for my first haircut in 2 years. Excellent service and some of the coolest people out there. Mark has bars and knows how to cut. One of the best tapers I've ever had. Expect me there every two weeks.
1/25/14,0.22414966,Positive,0,5.0 star rating,5,"I was at Black and Gold two weeks ago.  Mark was great.  I realized that I haven't had somebody cut my hair for 23 years!  Crazy.  Didn't know exactly what I wanted, but Mark got it right.  Great taper.  Going back today."
3/28/14,0.440625,Positive,0,5.0 star rating,5,"Black and Gold is a great place to go to if you're looking for the perfect bald fade. I started coming here after my barber, Sam transitioned over from Fine Line Barbershop in San Francisco. Sam is awesome. Soft spoken, but knows his craft. He's extremely professional, on time and creative. In general everyone at B&G is also very friendly from the moment you walk in. I come in every week and notice a lot of the same people which I think says a lot - happy clients!"
5/20/15,0.367156177,Positive,0,5.0 star rating,5,"Black & Gold is a very clean and lively barbershop, the barbers are top-notch and very talented. Rodney has been my main barber over the years and I couldn't ask for better service. He takes his time with his cuts and actually cares about his craft. Even with my hairstyle which takes much more effort than daily bald-fades and tapers, he always goes beyond to keep my hair fresh. Awesome shop that I hope to stay at for a long time."
3/15/14,0.47,Positive,0,5.0 star rating,5,Excellent service and attention to detail. I highly recommend this barbershop if you want a cut done by professionals.  Thanks Mark!
12/20/13,0.442222222,Positive,0,5.0 star rating,5,"If you need that perfect cut for any event, you gotta hit up Mark. Always hooks me up with a clean cut everytime I come through. Hes got all the freshest styles down to the T, whether its a fade, taper, or combover he always can adapt to whatever hairstyle you need. Only person I let cut my hair now.  Set up an appointment with him now if you need that perfect cut for the weekend!!!"
5/14/15,0.087053571,Positive,0,5.0 star rating,5,I've been going to Rodney for four years and every cuts been on point. He gets every cut right and takes his time to make sure your satisfied. You won't be disappointed!
3/14/14,0.32952381,Positive,0,5.0 star rating,5,"I have been all over looking for a good barber shop. I finally found one. Sam cut my hair. He was awesome. I got the tightest fade, probably ever in my life. I will definitely be going back. The shop is very clean. The staff were very professional."
3/13/14,0.200925926,Positive,0,5.0 star rating,5,"straight lines, perfect fade, takes the time with facial hair + razor... Hit up Mark at black and gold! 1st time I came by i didn't have change for parking, barber (mark) outside shop tossed me pocket full of change with no worries - these guys are on top of the barber shop game.- call in and make a appointment if you don't wanna wait- shop is hella clean and chill folks"
5/18/15,0.398888889,Positive,0,5.0 star rating,5,Rodney is my barber and I have known him since he use cut at fineline barber shop. He is very down to earth and keeps you entertained when he cuts you up. I am always very happy with the end results from his work.
9/5/13,0.2875,Positive,0,5.0 star rating,5,"First time here and at a legit barber shop. I had Mark. I didn't have to tell him much about what I wanted. Bald fade, trim on top, combover. Very reliable. And a hella chill environment."
4/24/13,0.33375,Positive,0,5.0 star rating,5,"My go to barber shop! I have been jumping around shops until October when I tried out this place. The place itself is roomy, clean, and the whole staff is friendly as well. I have been getting cut by Hubert and he is always on point! Hubert is very detailed and will make sure you leave very satisfied. He knows what he is doing and will cut your hair however you want it. He also uses a hot towel after facial hair trim (which is really refreshing) and uses a massager after your cut. Overall this place is worth the money for a clean cut and I recommend getting cut by Hubert! You can walk in, but I also suggest calling in for an appointment as they are usually busy!"
10/10/13,0.049425134,Positive,0,5.0 star rating,5,"Its hard to have to change up barbers but that was the position I was in when my previous barber didnt take his business as seriously as he should. Looking for a new barber I called Black and Gold one day asking about appointments and Mark picked up. I set an appointment with him and got my haircut. Mark is a really good barber and person he has good conversation and works around my schedule. He's great at what he does, he is laid back but very professional too. If your ever looking for a new barber Black and Gold has great ratings on yelp you cant go wrong with any of the barbers here but in my opinion just do a little extra and ask to speak with Mark. You will not be disappointed."
9/12/13,0.329666667,Positive,0,5.0 star rating,5,"Very chill, clean and welcoming environment to get a cut. Definitely a place I will continue to go and Mark always cuts me up with a clean bald taper with a facial line up I can count on. Definitely a barber and a barber shop filled with people who know what their doing and make you feel good about visiting.Location is also good too and very easy to get to."
12/11/14,0.063888889,Positive,0,5.0 star rating,5,"This review is LONG overdue. My man Mark has been hooking me up with the best cuts since I've moved to the Bay Area. As a black man who lived on the peninsula at the time, I was having a really hard time finding a barber who I could trust with my hair.    That was until I found Mark. Mark is from the East Bay and has a lot of experience cutting black hair. He is extremely professional and does a great job all of the time. Mark will continue to be my barber as long as I'm living in the Bay."
7/3/14,0.3,Positive,0,3.0 star rating,3,Got a fresh cut from Mark. Check him out.
10/23/13,0.16,Positive,0,5.0 star rating,5,If your looking for clean cut smooth  atmosphere solid barbers you really need to stop by Black and gold lounge. I see you Mark
10/31/14,0.66,Positive,0,5.0 star rating,5,"Great place, gave it a chance and I was really impressed. Cleaned up my beard and mustache perfectly. Great haircut also, and for a fair price. However they are cash only."
1/13/12,0.270740741,Positive,0,5.0 star rating,5,"The homie Dee from Fine Line Barbershop opened up his own barbershop / lounge.  As usual, he continues to service high quality cuts.  The place is a lot bigger, comfortable seats and couches, good music and conversation.  Located up and across the street from Jefferson High School.  Highly recommended!!"
10/19/13,0.041666667,Positive,0,5.0 star rating,5,Mark from Black n Gold can't fail if he tried. Every 2 weeks I walk out of Black n Gold with precision lines and a perfect shadow fade. I don't like to wait over an hour for a fade so 5 stars to Mark for keeping appointments and hooking it up!
2/2/13,0.325888889,Positive,0,5.0 star rating,5,"Had a great experience here at Black & Gold.It was easy to call an make an appointment. I'd recommend to call at least a day in advance to set up an appointment because they get pretty busy. I had my first cut at this barber lounge today. Hubert cut my hair, and he did a great job. He cut my hair like I wanted and even improved it. I got a very nice burst fade with a short comb over.The place is clean, has a comfortable couch and TV when you're waiting for your appointment, and all the barbers there are friendly. Definitely this is the place to be if you want reliable service and a great cut."
2/5/14,0.305357143,Positive,0,5.0 star rating,5,"I was just in this past saturday and had an appt. with Mark. This guy knows how to cut hair! he took his time and made sure i liked it. they had the ufc fights on inside and it was nice to be able to watch them while i was getting my haircut. pretty chill environment, i will be coming back and i do reccommend"
9/24/13,0.291666667,Positive,0,5.0 star rating,5,Great barber shop! GO HERE! You won't regret it.  Found my go-to spot and ask for MARK he will hook it up with a fresh cut!  Black & Gold Barber Lounge is the one!  BTW appointments only!
1/11/13,0.302666667,Positive,0,5.0 star rating,5,"Black & Gold is a great barber shop with many talented barbers. Hubert is the barber that I go to. Hubert knows exactly what he is doing and is very good with customer service. I came in late once for an appointment, but he managed to put in time for me that same day. There have been many barber shops that I have been going to around the area, but now I found the barber shop that I am going to be going to and that's Black & Gold."