Date,SentimentScore,Sentiment,SentimentNum,StarRating,Rating,Review
6/8/16,0.042202381,Positive,0,5.0 star rating,5,"This Man Nate came through when I needed him the most which was when I only had 30 mins to get to work and it was a 15 min drive. I understood that it was difficult to get a spot without an appointment but I walked in because the wait time wasnt so bad and I was rather desperate for a haircut. I literally went to every barber shop in Daly City and SSF that I knew of and every one of couldnt take me in. I asked for a mid bald fade and keep the top the way it is and man within ten minutes this guy whipped up his razors and did better than an average barber would in like 30-45 mins. Even prior to that he asked 2 men if it was cool if i go first because it was going to be quick and somewhat urgent and they happily obliged and Im guessing due to the fact that that they might know his ways. Last but not the least, five stars to the service and his desire to satisfy the customer but a life saving haircut after all the desparity. Right on Nate Bro. (Its a late review)"
6/28/14,0.6625,Positive,0,5.0 star rating,5,"Needed a cut since my Barber wasn't in town.  Yelped barbershops around my area.  Called and they had availability came thru the shop got a great cut with Nate Cool shop,  good folks, and a great cut."
5/21/15,0.333673469,Positive,0,5.0 star rating,5,Nate did an extraordinary job. I went in to change my hairstyle with fade on the sides and walked out with exactly what I was looking for. He took his time to make sure it was just right and the cut is extremely smooth and clean. Highly recommended!
7/24/14,0.2975,Positive,0,5.0 star rating,5,"Great shop. Relaxed atmosphere and Nate and Hector can both cut a mean head of hair. It's also good to see young men making a business investment in themselves, I really appreciate that."
10/4/15,0.154166667,Positive,0,5.0 star rating,5,this place hella legit... came in for first time not too long ago looking for a basic cut... ended up walking out looking like a million bucks! super clean and quick... dude knew what he was doing... got a girls number later that day so i will be def be back ... check this place out
4/13/15,0.064375,Positive,0,1.0 star rating,1,"If you want a barber that is unreliable, rude and unprofessional Nate's the place for you! Several times I've gone to this establishment only to find it closed during ""open hours"" leading customers to feel unvalued. Sure, the haircuts are decent but the intangibles are seriously lacking. These are the events that transpired... I get off work early at 3:00pm to get to Nate's at 3:30 to get my weekly cut. The door is closed and no one is to be found. I call Nate and he informs me that he is doing a bank deposit he will be back at 4:30. I wait an hour and still no Nate and barbershop closed (during open hours). I call Nate again and the response is unbelievable! ""I'm doing you a favor so just wait and I'll be there when I'm there."" I've been getting my hair cut from Nate for years mainly to support an old friend but if my giving him my money is a favor I'll take my business elsewhere. Anyone can cut a good head it's the other things such as reliability that make a barber superb. Until Nate learns the importance of professionalism and accountability this place will never see a dime from me again."
5/4/15,0.199116162,Positive,0,5.0 star rating,5,The long search for a barber is over. Nate is my new go to barber. He gave me one of the best tapers I've ever had! Doesn't rush when cutting my hair and was super friendly.
9/20/14,0.164583333,Positive,0,5.0 star rating,5,"Let me start by saying, these guys can cut. Been in San Francisco for only about a month now, I came up from LA and I struggled trying to find a legit clean cut barbershop for the first couple weeks. Before I came to this shop, some other barber messed up my hair completely, from my fade to my line up. Hector ended up cutting me up and he fixed it and hooked it up with a clean ass taper with line up. I'm looking for clean ass quality and Hector and his boys offers exactly that. I'm proud to say I found my barber here in SF. Everybody from SFSU should check out this shop."
2/24/14,0.312797619,Positive,0,5.0 star rating,5,Just went to the hates for the first time last friday had to get a fresh cut for the weekend and Nate hooked it up. Dope shop right off the M line so easy access for sf state students and he accepts credit card which is unheard of at most barbershops. Got the shadow fade and Nate did work. if you want a fresh cut in sf I strongly recommend you check out Nates.
9/16/14,0.416666667,Positive,0,5.0 star rating,5,"I moved into the area a couple weeks ago and I found Nate through Yelp. It was a bit of a wait, but the end result was definitely worth it. Nate gave me a clean taper fade and I'll definitely be back when I need another trim. If you want a great haircut, check this place out !"
9/10/14,0.534040179,Positive,0,5.0 star rating,5,Got a great razor head shave and really enjoyed talking bay area sports (SF Giants and 49er) ball with nate! The place is really nice on the inside and the chair is nice and comfy. He took all the extra steps to make sure i didn't get any bumps or cuts when he gave me the smoothest shave ever! Thanks Nate! And Go Giants and Niners!!!
9/8/14,0.516666667,Positive,0,5.0 star rating,5,"Just moved up here for school at SFSU and haven't been sure where to go for a barber shop. Found Nate's on yelp and it lived up to it's reviews. Got a great cut first time, no complaints. Would recommend it to anyone. Nate's the man."
8/26/14,0.602083333,Positive,0,5.0 star rating,5,"Great place, chill dudes with some skills! Greeting you as you come and ready the help you,  give you advice and always concentrated on their work. Place is also is also clean and organized! Results of cuts are amazing!"
6/30/14,0.427864583,Positive,0,5.0 star rating,5,"Nate and his barbers are hella cool!  Super nice and funny a great place to go and hang out, and also get your haircut!  Super accessible via M line!  Nate is the man with the clippers!  Takes his time and is super clean and precise!  He can do it all, his line ups are second to none!  Plus his hours are IMPRESSIVE,and I'm sure is one of the few barbers in this city who takes a credit card!  Got to be one of the best shops in the city!"
6/16/15,0.145833333,Positive,0,5.0 star rating,5,"went in for a haircut, no appointment, ddnt hav to wait long, haircut was fast and easy, walked out with a big smile...YAY!!!"
6/26/14,0.35,Positive,0,1.0 star rating,1,Found this spot here on Yelp. Def gotta check this spot out. Its a cool barbershop. Watch some sports as you get lined up. Nate is a cool dude n tgey open at 8:00 am which is good for me. Check this place out.
9/18/14,0.126190476,Positive,0,5.0 star rating,5,"Since I got out the army I been looking for a place to get my hair cut at, and I think I finally found one.  Even though my hair came out to short I'm still hella happy since it was my fault since I asked for a 3 on the side.  Anyways long story short if your in my shoes and every place you go to charges you like 30 bucks and you get some half assed cut then give Beto a try, this place is definitely worth checking out."
2/22/14,-0.214285714,Negative,1,5.0 star rating,5,"Ever been to a barbershop and as soon as you walk in you know everyone there can fade you proper?! That's this place. First time here, got a fade from Hector. Dude hooked it up with a sick cut!"