Date,SentimentScore,Sentiment,SentimentNum,StarRating,Rating,Review
5/26/17,0.17640625,Positive,0,5.0 star rating,5,"Jordan was my barber for today and he KILLED it. So much better than my past barbers, he's mad friendly. Suggesting styles that would match your hair and more. Get a hair cut from this guy!!! From the start to all the way to the end of the haircut, he puts 100% of his effort. His work and the environment here is A+, & for a great price! But hit up jordan for them fiiiiiire hair cut His specialties are shear work with long hair & finessed with his clippers and very sharp with his straight razor. He finished my combover with a finish style"
5/25/17,1,Positive,0,5.0 star rating,5,Took my son as a walk in and gave him a great cut and design just in time for his graduation.  No appointment no problem!
5/19/17,0.028571429,Positive,0,5.0 star rating,5,All the guys at the barber shop are really chill. I got my haircut by Jordan. He made my ugly ass messy hair actually look good and lined my beard up really well too. I definitely would recommend this place to anyone!
3/3/17,0.439,Positive,0,5.0 star rating,5,"Nate is an excellent barber. He was on time, friendly and very precise. I told him what I wanted and he delivered it to perfection. I would definitely recommend this place to anyone who's looking for a fresh cut."
2/8/17,0.387896825,Positive,0,5.0 star rating,5,I was lucky enough to just hop into Nate's and he cut my hair right away. Super chill dude plus a awesome cut. I get a fade so that's how Nate's was recommended to me. Not disappointed. Call for appointment or walk in
5/27/17,0.625,Positive,0,5.0 star rating,5,"Called in 30 minutes before coming in to this place.Great cut from Jordan, didn't rush and did exactly what I asked for, feels and looks great! Would recommend him to anybody"
2/23/17,0.305194805,Positive,0,5.0 star rating,5,"Nate's is an excellent barber, as a new customer he made me feel very welcome and cut my hair and beard exactly how I wanted which can be difficult when working with a client for the first time. I will definitely return. Check him out!"
4/23/17,0.3625,Positive,0,5.0 star rating,5,"Great group of barbers, they are clean and professional and always willing to go the extra mile to make sure you look good. Nate himself works there and works really hard to recruit good barbers that are customer focused. You'll enjoy your cut here!"
1/9/17,-0.046590909,Negative,1,1.0 star rating,1,"The owner Nate is mediocre at best, bad attitude and overpriced for the shoddy haircut that he gives... who is giving him five stars? Have you all ever gotten a real haircut?? I swear that a lot of these 5 stars reviews are given to themselves by the very same barbers who create fake yelp profiles to boost their star rating..  this butcher Nate...I mean barber if I can really call him that also had the nerve to ask me to give him a review on yelp lol.. well here it goes partner...oh by the way if you chance going there try to get there an hour before your appointment so you can find parking and pray your car does not get broken into."
10/11/17,0.25,Positive,0,5.0 star rating,5,It was my first time at a barbershop in SF and also my first taper fade. Nate had my cut looking exactly how I wanted ‼
9/8/17,0.232862554,Positive,0,5.0 star rating,5,I'm new in SF so it was very hard for me to chose the right barbershop. This one was the only one I had a good feeling about and that feeling was right. The vibe was good and so was the vibe of my barber. He's chill and he did an amazing job. This will probably be the only barbershop I will go to. I totally recommend getting your hair cuts here.
5/7/16,0.338655099,Positive,0,5.0 star rating,5,"#IMUSTVOTETHISMYBESTBARBERSHOPINSF!!!!!It was our 1st time to Nates' Barbershop and we got Nate ;-)! We had tried a few places in the Bayview but, hey sometimes things fade away(lol).So, I went to Yelp and was looking for a Barber in the Oceanview area my old neighborhood where I grew up. So naturally I turned to to Yelp and once again the almighty Yelp has not let me down, yet!Nate's barbershop was not only one of the cleanest shops we have been to in San Francisco but, they were extremely friendly and very professional. I was impressed by their concentration level while working on each clients head for they all were completely engaged and into their art of greatness! Nate got my son in his chair pretty fast and it was not a long wait at all. It was a great environment and positively entertaining with a great NBA basketball game on I was happy I did not miss watching #KingJames play. ;-).I showed Nate 2 pictures and he delivered and gave my son a better hair cut than ""The Clay Thompson Bald side Fade"" Cut! ;-) My son was happy and so, was I! Yes, it is worth $20 especially when you see Nate use the Old school ""straight-edge razor"" and tops the ending of the haircut with his skills. . . .wow! Now that was impressive and really showed off his level of expertise and skills in his profession.Thank you Nate! My son is really happy with his new cut and you did an ""AWESOME"" job. We will be back and even when we move to Sacramento when we are in town we will come by to see you. -Aminah & Z"
7/3/15,0.237820513,Positive,0,5.0 star rating,5,"Overrated!!!Just kidding! Small but effective. Quick and precise. It's a half hour further from my regular barber, but definitely worth the ride. Great pricing and service. Fun neighborhood too, all their clients were very interactive. Thanks for the fresh cut Nate!"
7/11/16,0.1375,Positive,0,5.0 star rating,5,"Just got a haircut today with Nate. He was awesome!He's with 2 other guys who seem to enjoy what they do. Also, they seem to like sports so if you want to share your thoughts about any sport, this is a place to go."
8/12/16,0.169665404,Positive,0,5.0 star rating,5,"I have been going to random barbers for the last 5 years and never satisfied in the SF area! My hair would be cut all different ways and I would always end up shaving it off or fixing the different lengths. Most months, I went to my barber in Fresno because I couldn't find a decent barber.Today I walked into Nate's and Mike cut my hair well. I'm excited to be able to have a new barber I can go to biweekly. My hair and beard looked awesome walking out! I made an appointment for 2 weeks out and I am stoked to have a new place to get my cut!"
9/8/17,0.304166667,Positive,0,5.0 star rating,5,"First time I've ever been to Nate's and got a really clean haircut/beard trim, he does a really nice job paying attention to detail and will defiantly come back"
1/30/16,0.053794643,Positive,0,5.0 star rating,5,"Nate has always been super accommodating whenever my regular barber isn't available. I shoot him a text the day before I need to come in and my appointment is locked in. When I get there, I only have to wait +/- 15 mins because a cut is running a bit behind or someone had a previous appt who hasn't gone up yet.The haircut itself is meticulous despite how fast he cuts. Although my current cuts have been relatively simple (mid fade & line up while leaving the length up top) because I'm growing my hair out, I still feel he does a commendable job. I've even received compliments when I'm out after I get a cut. I definitely recommend Nate's if you're in the neighborhood and are looking for a barber. Definitely my go-to when my regular guy is unavailable.PRO-TIP: Don't park right in front unless you want someone to box you in until their cut is finished. Had to learn that the hard way. Park around the corner or a couple blocks away."
1/31/17,0.298333333,Positive,0,5.0 star rating,5,"Good blokes, nice quick haircut and being able to walk-in is great. Don't really trust too many people cutting my hair, but I read good reviews and wasn't disappointed."
7/26/17,-0.111666667,Negative,1,5.0 star rating,5,Very clean cut. Place may seem bad but the haircut is all that matters. Would recommend for fades.
5/21/17,0.441666667,Positive,0,5.0 star rating,5,He was a nice guy and did a good job on my hair. Came in at 8 which was pretty early so glad he was able to make my schedule work for him.
11/4/16,0.232346189,Positive,0,5.0 star rating,5,"Been coming to Nate for the past 10years. Have seen his company grow from the ground up. They have the best barbers in the Bay Area. Only shop that I know of that all barbers can cut. You can't go wrong with any of them. Best shop hands down. Each barber is unique in their own way and that comes from leadership. They give you that old school feel with new school vibes. They give you that comfort feel of what a barber shop is. Come and check them out, be aware tho at times it may get crowded so always call in advance. Dope shop."
11/14/16,0.35,Positive,0,5.0 star rating,5,I had a wonderful experience at Nate's. Top notch hair cut and Nate is an upstanding guy who cares about his customers. I will definitely be coming back again. ;)
9/23/14,0.137799874,Positive,0,5.0 star rating,5,"I called ahead & was lucky enough to get a ""drop in"" appointment. After my cut started, the line formed quickly. Like any shop, make sure you don't just show up unless you've got nowhere to be. Nate's is a little off the beaten path. So I got to park across the street easily, but it's also not really near anything so don't expect other hidden gems, (At least I didn't see anything else). Make sure your phone is charged so you stay busy during your wait cuz the tv will be behind your head until you're in a chair.Styling for the cut was straight forward & precise enough. I got my comb over & aside from the top being just a touch longer than usual it was pretty nice. See the pics. Price was average, $35 with tip. I'm a fan of the cut, & the guys here were cool. It's worth checking out if you are looking for a new spot.CHAD"
3/5/17,0.465277778,Positive,0,5.0 star rating,5,I called Nate one Monday morning when I was looking for a place to cut my hair through Yelp and he told me to come in since he was free. He was quick with the cut (I got a 2 on the side and a trim on top and he was done within 30 minutes) and I came out with an awesome haircut. Nate pays attention to detail and asks you specifically for what you want. There is also easy street parking near his shop. From now on I plan to set up an appointment with him!
8/26/16,0.725,Positive,0,5.0 star rating,5,"I got an undercut here done by nate and he was amazing! they've got skills here, and really good customer service."
5/27/17,0.533333333,Positive,0,5.0 star rating,5,"Before coming here I did not know that it's okay for a customer to have a haircut without looking at the mirror during the process. However, at the end got nice and stylish hair."
8/4/16,0.451111111,Positive,0,5.0 star rating,5,"Got my cut from Nate. I cant speak more highly about him. His work ethics are incredible. He has a great outlook on life and he genuinely cares about his crew. Oh yeah, he does a great cut to. :) Even though I just moved out of the city, I am still planning on making trips back into the city for my future cuts--I just scheduled one with Nate for this Saturday."
5/25/16,0.25,Positive,0,5.0 star rating,5,I think place is great for men only because the kid looked great that went before me. He didn't know how to separate my long hair or tie it up. I have various lengths of shaved hair some close to an inch long.
6/4/16,0.113299513,Positive,0,5.0 star rating,5,"This is a real easy 5. My current barber has been a bit unreliable (partially, he's not to blame. I'll leave the names out, but in all fairness the shop nearly closed a few months ago and some changes by the owner/management have shaken things up) While it's always hard to leave, I needed to check out something new. Plus, I was heading to my family reunion in Las Vegas for the weekend and had to get a cut. I texted Hector literally out of the blue and he responded right away and made excellent communication with me not only to book the appointment but about my expectations for the haircut. We made a 7:15am appointment on a Saturday morning (which, I had to let that soak in.) Hector arrived on time, greeted me by name and he was very professional (gloves, apron, clean station.) I gave him a brief description about how I wanted my hair cut and he nailed it -plain and simple."
4/29/16,0.257777778,Positive,0,5.0 star rating,5,"Nate's is a solid shop with skilled barbers. Ive been a few times now and Im not only pleased with my fade, but they go out of their way to answer any questions I have about the style or maintenance. Very comfortable and appointments make it easier because they get busy fast. Check out Mike L. He has a good eye for detail."
9/29/16,0.125,Positive,0,5.0 star rating,5,"I recently moved to San Francisco and struggled to find a good place to get my haircut. I went to a few places and the outcomes was terrible. After searching through yelp I found Nat's barbershop. I called and Nate got me in the very next day. Nate was inviting, conversational, and did an excellent job on my hair. I will most definitely be back."
8/29/16,0.074045139,Positive,0,4.0 star rating,4,"This is my first time i've been to a Barber shop. After looking for numerous shops around Daly city area, and i finally found Nates. Oh boy, Nate made sure he took care of me well. I got the Freshest Undercut hands down!! This will be my go to spot for haircut from now on!!"
7/20/15,0.22,Positive,0,5.0 star rating,5,"I've been consistently getting cut from Nate for about fives years now & I must say he has excelled over the years & practically he has mastered the craftsmanship of being a barber. I recommend him to any who wants a fresh cut. Although he may be busy on weekends and Fridays, I promise if you make a appointment on any morning, you will be the first to be cut by this master of the ceremonies."
9/6/16,0.152597403,Positive,0,5.0 star rating,5,"I called at 10:45 and they told me to swing through. I only live 4 min away but I just moved to SF so I didn't really know any other barbershops. I walked in and just took a seat and figured I'd get in when they were done with their appointments. As soon as a chair opened up, Nate waived me over to the chair and asked if I was the one that called. I showed him a pic of what I wanted (a fringe type haircut that was pretty different from what all the other barbers were doin) but said that he could do it. 15 min later I walk out with a fresh ass cut that my girl liked so I know it was good. Definitely will be coming back thanks Nate."
8/26/16,0.15,Positive,0,5.0 star rating,5,Was looking for a place to get my hair cut and read the reviews. Called to see if I could go in immediately for a haircut and was able to. Hector M had my hair cut in about 20 mins and there wasn't a long wait. Will definitely be back for another cut in a week.
2/18/15,0.1828125,Positive,0,3 star rating,3,They get 5 stars just for being able to get me in on a Friday afternoon. -.5 star for a rushed haircut in and out in 15 minutes which can be good but I didn't like how square some of my hair looked. I have Long hair on top and short on the sides I guess he didn't want to risk cutting the long hair. Could be worse and he cut a lot of the long hair but instead didn't try to get in there and get close with the cut. -1.5 star for telling me the cut was $25 and then letting me know there was nothing I needed to sign after I swiped my card. Of course i cash tipped since i didnt have to sign. Much to my displeasure the charge on my cc wasn't 25 bucks. Only a couple bucks more but telling customers wrong prices while swiping isn't the best. Generous 3 stars. The guys were friendly and you can get a haircut in before the weekend which is really great.
7/20/16,-0.0625,Negative,1,1.0 star rating,1,Always get cut by Mike. Always on point. I have never been cut by any if the other barbers but they all do solid work.
10/8/16,0.191,Positive,0,5.0 star rating,5,First time I visited the barbershop. Make sure to book an appointment with some of the barbers because two them I believe only take appointments. It's usually busy. I booked an appointment with Hector and my haircut turned out great. He's efficient and provides quality haircuts. All the barbers are chill and overall it's a laid back environment. The shop is also conveniently near the M train stops. Highly recommend. Will be coming back!
1/9/17,0.448958333,Positive,0,5.0 star rating,5,Nate cuts clean af !!! Super fresh cut every time i come in. Clean lines and takes care of you! They have fun in the shop and manage to keep you looking fresh. Dope spot !!!
9/22/16,0.331,Positive,0,5.0 star rating,5,"I just came in early this morning and got a fresh cut from Hector. He hooked me up with a fresh combover with a fade. Not only he can do a good job with hair, but he can carry a good conversation as well. This is the first time that i've been here and I can't wait to come back. I highly recommend this place for anybody seeking a great quality haircut."
5/18/16,0.473275162,Positive,0,5.0 star rating,5,"Decided that I would give a new shop a shot. Came in with no expectations and they did a great job. Walked out feeling good, looking good. Definitely plan on coming back for more. Wedding season coming up!!!"
7/7/16,-0.125,Negative,1,5.0 star rating,5,"Been getting cut by Nate for years...never dissapoints. Come see them, they will have you looking SHARP. TRUST"
6/22/16,0.25,Positive,0,5.0 star rating,5,"Dope ass taper fade they gave me and good attitude toward customers so i suggest you to go there and get your moneys worth here , definitely coming back here!"
11/14/16,0.266666667,Positive,0,5.0 star rating,5,"Glad I finally found a barber worth going to in the bay area. I just moved to SF from Atlanta, and have struggled to find a decent barber. I went to Nate over the weekend and was extremely impressed. This place is the real deal, without all the frills. Just a damn good barber shop, and it shows in the loyal customer base. I was there at 9am and people had already started lining up out the door. This man knows what he is doing and it shows."
11/11/15,0.185648148,Positive,0,4.0 star rating,4,I've been to alot of barber shops where the customer doesn't matter! That isn't the case at Nates customers come first. It's a very friendly and open barber shop. There is always a sports discussion going down for anyone into sports. I myself don't care to speak but enjoy to hear the convos in the shop. Nate the owner is one of the most down to earth and best shop owners I have met. Each and every time I have come his customer service is above and beyond and his friendly and always willing to meet all my needs in the shave and cut I ask of him. He even has taken me at last notice last christmas eve! If you have not been to this hidden gem of a barber shop I suggest to give them a chance the next time you need a trim.
10/24/16,0.177777778,Positive,0,3.0 star rating,3,"My barber was out of town and needed an urgent haircut. Nate welcomes walk-ins, is professional, skillful, easy to chat with, and worked around my schedule. Definitely recommend to pay him a visit."
2/26/16,0.2875,Positive,0,5.0 star rating,5,"I Needed a cut before a trip called Nate and he took care of me. Above and beyond what I was looking for, great Barber and legit shop cool group of Barbers. Definitely gained my patronage 5 star no doubt about it!"
8/17/15,0.33,Positive,0,5.0 star rating,5,5 stars all around! First time here and I have to say this is one of the best barbershop in town. Shout out to Nathan for taking me in last minute. Told Nathan what I wanted and the outcome was better than expected.
9/27/16,0.233333333,Positive,0,5.0 star rating,5,I got a haircut here about a week ago and it was an overall good experience. I will probably be back once I need another haircut.
7/3/14,0.352380952,Positive,0,5.0 star rating,5,"This place OPENS AT 8.This place TAKES CREDIT CARDMost importantly THEY CAN CUT HAIR. If this hasn't blown your mind already, you may have not tried to get a haircut in DC before. Nate gave me a clean ass fade today. Very skilled and meticulous - Real low key cool dude - has a good mind set about having a shop."
6/24/15,0.240816327,Positive,0,5.0 star rating,5,"Mike L gave me a sick fade and an overall great experience in the barber shop. I didn't have an appointment and he fit me in and was very flexible and easygoing. I had some great  barbers in LA and so I am picky about who cuts my hair, the straight razor etc. and I give this place 5 stars and thank you Mike. I got a lot of compliments. Haircut price is customary for this area."
12/3/15,0.3,Positive,0,5.0 star rating,5,"Solid all around. I was able to get in, get out, and look good. I will definitely be a returning customer."
12/1/14,0.322222222,Positive,0,5.0 star rating,5,The shop is clean and nice. I spend only 30 min there and leave with a hairdo that I planned to have.
9/15/15,0.335,Positive,0,5.0 star rating,5,Chill friendly environment. Walk ins are acceptable which I thought was convenient and all of them can do a fresh cut. I had Mike my first time and he was able to give exactly what I wanted.
7/19/15,0.182407407,Positive,0,5.0 star rating,5,"Found Nate's Barber Shop via Yelp and was not disappointed. Needed an emergency cut on a Monday (most barber shops are closed on Mondays so definitely a plus for being open ) for an interview. Nate followed through with my scheduled 2:30 appointment and I left with a fresh cut and my beard attended to. With the straight razor, my lining on my beard looked clean for days."
8/30/16,0.197619048,Positive,0,5.0 star rating,5,"The owner is a good guy, was open mid-day on a Monday for my first cut. Easy to talk to, will definitely be going back for the next one."
7/5/15,0.24,Positive,0,5.0 star rating,5,"Best barber shop in town. Been going to this guy for years. Great group of men. Nasty Nate, Beto, Mike, and Hector. I highly recommend this spot."
1/2/15,-0.46875,Negative,1,5.0 star rating,5,"Nate's cuts are always on point! Been going there for 2 years, never left the shop disappointed!"
8/19/14,0.099652778,Positive,0,5.0 star rating,5,"I've been going to Nate's for about a year and a half now, and I have nothing but GREAT things to say about him and his shop.  I have never seen Nate turn down a walk in, and I've gone into barbershops that are EMPTY, but get turned down because I didn't make an appointment.He accepts DEBT and CREDIT cards, which is extremely convenient for me.AND OF COURSE, HE DEFINITELY IS A TALENTED BARBER!!I recommend you visit Nate, Hector or Beto at Nate's Barbershop next time you're in the area and need a quality hair cut!"
8/14/15,0.5,Positive,0,5.0 star rating,5,"Great haircut, slide through. Good vibes you can definitely feel the barbers cut with passion."
4/10/15,0.6375,Positive,0,5.0 star rating,5,Good folks here that can cut hair! Very friendly and walk ins are good! Nate lined me up and it was exactly what I wanted! def recommend this place
3/26/15,0.395833333,Positive,0,5.0 star rating,5,Hector did a quick amazing haircut! Will for sure be coming back and sending anyone who asks about a haircut to Nates.
9/22/15,0.65,Positive,0,5.0 star rating,5,Nate gave me a great cut and it was time efficient for me. I'll be coming here for sure again.
4/13/15,0.302083333,Positive,0,5.0 star rating,5,"Awesome job by Nate. I've had the same cut for the last decade and decided to change things up.  He did a great job keeping it clean and simple, which is exactly what I wanted.  I'll definitely be back!"
10/14/14,0.333333333,Positive,0,5.0 star rating,5,This place is awesome! Open super early Thursday-Saturday (7:30 AM) and they go straight to business. Just moved into the area and found this place through Yelp. Great typical barbershop atmosphere where everyone talks with one another. I got a super clean combover haircut and it was so good that I will be coming back again. They take appointments as well as walk-ins.
8/28/14,0.293349075,Positive,0,5.0 star rating,5,"5 STARS! I've been in SF for 3 years now and this is where I've gotten the best cut. Plus they take debit cards, which I think is pretty cool. When you do go, ask for my boy HECTOR, I can honestly say he will have you looking right, the man can cut! Chill shop, good group of guys from what I've seen. I Don't usually go to barbershops but I think this will be my new spot, will definitely be back. Hector even busted out a business card. Gtta love the professionalism, shows this man takes his job seriously!"
9/2/14,0.174242424,Positive,0,5.0 star rating,5,Great haircut. Nice clean shop. I saw Hector. He really pays attention to detail and gave me options when I wasn't sure how short to go with my hair.  He also handled my awkward hair line really well.  Go in the mornings when it's not busy.  And parking sucks so take the M.  Also really close to SFSU and CCSF which is why I went over.
