Date,SentimentScore,Sentiment,SentimentNum,StarRating,Review
2/28/18,0.413494318,Positive,0,5.0 star rating,"Found my new salon! I came in with a hair disaster and Justine worked her magic and gave me the most beautiful balayage/ ombre coloring ever. Justine won't let you walk out of the salon until you're happy and to say that I was happy is an understatement; I was over the moon ecstatic with the results of my hair. Everyone, and I mean EVERYONE of my friends and family commented on my hair the days following (and still do!). If you're thinking of adding excitement to you hair, Justine is your gal!"
1/19/18,0.224475108,Positive,0,5.0 star rating,"I don't really write reviews but I am over the Moon happy with the results of my new doo! I've had long, dyed hair my whole life and was extremely skeptic at first if I should go through with cutting my hair or not but after a previous bleach job that fried my hair I decided I needed a change. I read a bunch of reviews and searched through dozens of pictures. After reading through some reviews about Ashley Sue I decided to book my appointment. I got a call next day from her and she talked me through the process and asked me to send photos and gave me great feed back if this was the right look for my facial features. I didn't want someone who just agreed with everything I asked for and wanted my business but someone who will give me real critical feedback. Ashley Sue was straightforward and honest with me about everything from color, length, and even showed me how I can style short hair afterwards!Go to Ashley Sue! She does amazing work! What a wonderful experience."
3/23/18,0.321428571,Positive,0,5.0 star rating,"To all the blondes out there scarred to let anyone touch your hair, look no further. Justine is amazing and did a fabulous job on my hair. My hair was left undamaged and the color looks the exact same from 6 weeks ago. They also use all the best products and sell them at the front. Check out Justine's instagram @justineraestyles for proof of her talent and dedication ‍"
2/22/18,0.411607143,Positive,0,5.0 star rating,I went there to get my hair done by Ashlee sue she is amazing and I'm so happy with my haircut and color she's totally approachable and really friendly. She knows what she is doing! I was going for an icy silver look and I'm really happy with our first session and how it turned out!
1/14/18,0.390740741,Positive,0,5.0 star rating,"My experience here was awesome! Justine did a beautiful job!!! I came in with about 2 inches of dirty blonde regrowth and solid yellowish hair beyond the regrowth and I left with beautifully blended, bright creamy blonde hair with great dimension. I am so happy with the results, they'll make you say WoWza for sure. Thanks again Justine!!!Also, the salon is super cute and booming with a cool atmosphere and nice people. I will definitely be back!"
2/9/17,0.102941176,Positive,0,2.0 star rating,"What I had: long (like to my butt), thick, coarse Asian hair in the shape of a V but with too many layers in the middle.What I was looking for: about 2 inches taken off to give it a healthy look and to also even it out so there weren't so many layers in the middle but to keep the same V shape. Bang trim and some thinning.What I got: short, blunt cut. V shape was gone.What I got (2nd chance): short, choppy, uneven layers. Still no V shape.Pretty bummed. Was hoping this salon would be my go-to, but unfortunately won't be back. Looks great in a pony tail! So that'll be my hairstyle for the next 6 months before I let anyone take shears to it again..."
11/30/17,0.417857143,Positive,0,5.0 star rating,Justine Rae is amazing!!! You can tell she really cares about giving you exactly what you want and doesn't mind putting in the extra work. She did an amazing job on my hair and I have already gotten so many compliments! Thanks Justine and studio fifty fifty!
3/23/18,0.371428571,Positive,0,5.0 star rating,Love love love my hair. Sarah R was amazing. She was able to transform my hair in one session. Definitely recommend her and will be coming back to her.
2/19/18,-0.009090909,Negative,1,1.0 star rating,"Went in hoping this could be my new place... I showed a very specific photo and what I wanted, and came out butchered... I stopped the hairdresser mid way through to say that this was not what I wanted and it was too short, and was assured it would be ok... It wasn't. I can't even get my hair into a ponytail to hide the bad cut.... will never be back..."
1/20/18,0.533996212,Positive,0,5.0 star rating,"first time i've ever colored my hair & i love it so much!!! Kirsten is such a great hairdresser, super nice & friendly. She's great at balayage! it came out perfect, couldn't have asked for a better experience!"
12/19/16,0.483333333,Positive,0,5.0 star rating,I absolutely LOVED the work that Kirsten did on my hair! She did an amazing job fixing my grown out color and damaged hair that a previous stylist did.I found my go-to person to do my hair and I love her!
12/13/17,0.206666667,Positive,0,5.0 star rating,Kean is great! Both my husband and I go to Kean. I feel bad because I can hardly hear when people talk to me as it is and with blow dryers and what not it makes it harder (since there are so many people and its so big) but other than that everyones been super nice and ive seen beautiful work done.
12/19/17,0.522466856,Positive,0,5.0 star rating,"Tara was amazing! She was super sweet, made me feel really comfortable and I knew my hair was in good hands! She gave me the hair cut I wanted and even scheduled me for a trim in three weeks! I'm super happy over my new Bettie bangs! It took me forever to find someone to do them correctly!"
4/16/17,0.004615385,Positive,0,1.0 star rating,"To keep it short and sweet. This place is way over priced and completely ruined my hair. I came here with high expectations bc of such great ratings. I had long dark brown hair expecting to get a blonde balayage but left with bleached streaks. I paid 210$ for literally 7 random pieces of my hair bleached and ""toned"". When I asked if the rest of my hair was going to get bleached my hair stylists said ""no"". My hair was fried and looked disgusting... Sydney did my hair. I showed her a picture of what I wanted (which I will post) and it turned out nothing like the image AT ALL. She was sweet but as a hair stylist I would not recommend going to her."
1/5/18,0.4,Positive,0,5.0 star rating,"If you are looking for a stylist that does an amazing job with extensions look no further. Joanna, you're the best!!  Thanks so much luv"
1/4/18,0.4125,Positive,0,5.0 star rating,Studio fifty fifty is the real deal. There's not to many places in the OC where you experience quality service and a welcoming atmosphere. Plus some yummy cookies and wine. Thank you silvanna!
11/22/17,0.104821429,Positive,0,5.0 star rating,"""Hair emergency? What?? There is no emergency in hair!""Let me tell you: THERE IS. And you can believe me, because I'm really not the type of person to have a hair emergency. In fact, until this week, I didn't think hair emergencies were a thing.I walked into this place with my hair an ACTUAL disaster. I mean, a non professional, bleached my hair. It was orange... IN PATCHES. I mean... I must have looked like a McFrickin cheetah. And this was the week of Thanksgiving. I mean, I love my family... but let's not lie: a lot of people have a firm belief that holidays are for judging. My family are those people a little bit (a lot). Also, photos are forever. So, I was a little stressed.I walk in to Studio 50/50. Kean Rager takes one look at my hair, and just *fixes it.* The man didn't sweat a drop. Just made it happen. The phrase ""miracle worker"" comes to mind. He didn't talk my ear off, listened while I complained about things, we talked when we wanted to, it was no pressure. Plus, watching his hands go was awesome.My hair looks VERY nice, and I'm really happy with his work. Ask for Kean! He's awesome!"
12/25/16,0.475446429,Positive,0,5.0 star rating,"Dianne makes the best arrangements around! I've bought my wife flowers from Costco, Ralphs. Albertsons, flower shops in Newport Beach but these flowers Dianne makes last over 2 weeks! They smell so good and my wife ALWAYS knows when I don't get her flowers from Studio Fifty Fifty. Guys...save yourself a headache and $...go and see Dianne. Oh and the candles they have are AWESOME. Smell a good. One last bit of advice..try and get your order in early. Dianne gets tons of orders and it's always nice to give her some time to make your arrangements special. My wife and youngest son see BROOKE. She is such a sweetheart. My son is 6 and doesn't want anyone touching his hair but Brooke is so nice and he warms up to her! My wife goes to Brooke and she Always leaves happy. Everyone at Studio Fifty Fifty is sweet and welcoming. Not to mention I can shoot the shit with some of the people their and have a beer! This place is awesome."
9/6/17,-0.003803938,Negative,1,1.0 star rating,"I've contemplated leaving this review for several months now. I had a bad experience. I went in for balayage touch ups and a trim and walked out with a very brassy full weave. This stylist agreed to do balayage. She has been with the studio since they opened (she said). This is a supposed high-end salon. I apparently confused her with my straightforward request. I came back for a correction. She used an ashy toner over the hair instead of painting back the brown I requested. I was shocked that I now had grey hair. I had to hold back tears. She was not happy that I was not happy still, but said I confused her AGAIN. We're both native English speakers so I don't know what this is about. She asked me if the cut was ok. I said yes because I was not going to allow her to put scissors to my hair again. I left never to return. The toner washed right out. My hair was very damaged considering it was a full weave instead of some balayage highlights. I went back to my old hair dresser (I moved away which was why I was looking for a new one) and she fixed my cut and gave me advice on how to treat my hair so it stops breaking. I don't think this is a high end salon and everyone is cramped up against each other. No one with proper training would not be able to understand the difference between regular foil highlights which are weaved uniformly throughout the hair and balayage, a technique where highlights are hand painted freehand. Oh and by the way, I came out with two toned hair as well. The place has a big sign that says no refunds. I gave her a chance, but hair, once damaged, does not heal and I didn't want to completely destroy it."
8/13/17,0.562916667,Positive,0,5.0 star rating,"I went into Studio Fifty Fifty on a Saturday this week, everyone there was very nice! The establishment is very clean and they use great products. I would definitely recommend this salon to anyone in the area"
12/8/17,0.146923077,Positive,0,5.0 star rating,Justine did an amazing job on bringing my hair back to life I didn't know that I could be a white blonde and have such a toned color because everyone I've gone to in the past has never been able to get me to that color but she got me to that color andtoned my orange completely out I'm so thankful that I went and saw her and I highly recommend seeing her if you are a brunette or a blonde who has box died and wants to go to a amazing toned blonde color
1/10/17,0.55,Positive,0,5.0 star rating,"Great place if you want to change your hair style!  Fancy place, love love the atmosphere and interior design.  Sarah R cut my hair short per my request and did an amazing job!Love the owner too!"
11/22/17,0.319640152,Positive,0,5.0 star rating,"I made a last minute call to this salon to see if I could get an appointment for some fresh holiday hair. Justine took me in and first she asked me what I was looking to get, we talked about colors and she explained the process in an easy to understand way-because I dont know hair terminology she was amazing ans talked me through the whole process, always made sure I was comfortable & my hair turned out Ahhhmazing. If you need a fresh new look or just want some tlc on your locks ask for Justine!!"
11/21/17,0.409375,Positive,0,5.0 star rating,Just had my first appointment with Justine and she did such an amazing job! She transformed my hair from brown to a beautiful blonde balyage! She is very friendly and really gives you what you want!! Love her!
3/1/17,0.296309524,Positive,0,5.0 star rating,"First things first ASHLEE SUE is the Best.If you need a Miracle and want to keep your hair length she is your to go girl. I was a hot mess,I  came in with a 50 Shades  of brown hair color, I was not expecting to be  blond on the first visit but she did it how not sure you would have to try her out ,Ashlee  is super friendly very attentive she made me feel very comfortable it was my first time at Fifty Fifty and beyond pleased she worked her magic and listen to my wants and needs.I couldn't be any Happier Thank You So So Much  Ashlee Sue"
7/6/17,0.097478992,Positive,0,5.0 star rating,"I wish there are negative points so I can rate this store. I make appt at 7:30pm and leave my work one hour earlier to make this. They called me twice to confirm the time and ask my Credit card info in case I cancel. And then they called me three hours earlier to ask if I can reschedule earlier- I say I can't. And I arrive there 5 mins before the appt time. They told me that it's gonna be a 20 mins wait cuz she is finishing up the one before me- I was not happy but I think it's fine and understandable. And 40 mins pass, nobody shows up. My hair stylist is still taking care of her customer. Cashier asks me if I wants to purchase any hair product bcoz she is closing her computer. Wanna make sure I don't need any extra purchase.This is not right.  If you are gonna charge me if I cancel the appt within 24 hours, then  I should charge u for delaying the appt without any notice and have me waiting there for more than half hours. They saw me left angrily. And didn't even say a sorry.I am sure they do great haircut. But plz learn to respect your customer first."
7/23/16,0.141130051,Positive,0,5.0 star rating,"I should preface this by saying I have never colored my hair anything but a natural brown. And while Erin was great at that, I think the real moment where she surprised me was when I decided I wanted to add red to my hair.I'm typically pretty specific with my hair because I've had one or two bad experiences (not here) in the past. Anyway, I told Erin I wanted red in my hair and while I had a bit of sticker shock when the dye went in, I was so happy with how it came out!! I feel like a completely new woman! The atmosphere of the salon is pretty cool. There's cookies and water readily available for your indulgence whereas other salons have that kind of hidden. And depending on the time of year, it's themed! So you'll have orange frosted cookies during Halloween and red white and blue frosted cookies during 4th of July, etc.The chairs are comfortable--even the ones where they rinse your hair. So that's a plus to me.I would definitely recommend this place! And I have a pretty high opinion of Erin too!"
2/22/17,0.625,Positive,0,5.0 star rating,"Studio 50/50 is ah-mazing! Erin is the best and does a phenomenal job! The service is great and they offer so much. Hair, nails, eyebrows, and eyelash extensions... this is the place to come for all of your beauty needs. The free wine is a plus!"
1/26/18,0.41944756,Positive,0,5.0 star rating,"Last year when I moved here from New York,getting adjusted to new places and trying to find my go-to spots for things was a challenge. But since the first day I walked into Studio Fifty Fifty, I was blown away. The high quality of service and attention to detail was unlike any salon I've been to. Like most, my hair and appearance mean a lot to me. As soon as I met Rio and we got started talking, I knew she was going to be my go to hair stylist. Her bubbly and energetic personality is so inviting, she truly makes you feel comfortable. I used to be very picky with how I want certain things cut or styled but every time I go see her, I just let her do her thing. She absolutely SLAYS my hair every time  She is so detailed and focused on what will look good on you and make you happy. She's honestly the best hair stylist I have ever been too and on top of that she is an amazing person with a heart of gold. I strongly encourage anyone looking for an incredible experience and hair expertise, go see Rio, she will take very good care of you"
2/15/17,0.341335227,Positive,0,1.0 star rating,Heather! Heather! Heather! This review is way over due!! She is simply the best! I didn't find her on Yelp because I've been going to her for over 15 years. She listens. She gets it. She's consistently good. Thru out my punky color/style phases and  my more conservative phases. She nails them all. She is also hilarious and genuine and becomes your instant bff. I've  been there when she's seeing multiple generations of clients. They/we all consistently trust her. Cut/color.. Women's/men's/kids/unisex. She also does my brazilIan  blow out amazing too.
1/20/18,0.1425,Positive,0,5.0 star rating,Justine did an amazing job on bringing my hair back to life I didn't know that I could be a white blonde and have such a toned color because everyone I've gone to in the past has never been able to get me to that color but she got me to that color andtoned my orange completely out I'm so thankful that I went and saw her and I highly recommend seeing her if you are a brunette or a blonde who has box died and hwants to go to a amazing toned blonde color
12/31/17,0.272727273,Positive,0,5.0 star rating,Came in to see Justine just before the holidays and she color corrected my silver/blue hair to a gorgeous amber/beige balayage. I left the salon feeling fabulous and ready to take on the New Year ‍ Thanks chica xoxo
9/8/17,0.45,Positive,0,5.0 star rating,"Eddy is awesome.  Great customer service.  Parking lot could be better, but it could be worse!"
5/20/17,0.0875,Positive,0,1.0 star rating,"Went in for highlights, i got turned into a streaky blonde for $140, cool. Had to go to a different salon to dye it back brown."
12/9/16,0.219989418,Positive,0,5.0 star rating,"Joanna is amazing. I can't stress that enough. She takes care of her clients and has an ease that makes you feel at home. She does wonderful things with my hair, and her knowledge not only of the chemistry of colour and the techniques of colouring and cutting and styling, but her knowledge of people is absolutely fantastic. I am a client for life! But do not think she is the only fantastic human being who cares for clients here. Everyone is warm and welcoming and even the assistants have more knowledge than most hair technicians at the other salons I've been to. Everyone from the receptionist to Joanna has been hands down amazing. The salon itself is incredibly comfortable and inviting. They offer snacks and drinks (water coffee beer and wine, both red and white!) complimentary while you're being pampered and well taken care of. The facilities are impeccably maintained. Hair care is messy, trimmings, product, hair colour, it all makes a mess - but the salon is kept well cleaned. The standards are incredibly high - and it's worth every single penny. Absolutely every penny. I love Studio Fifty Fifty - and you will too. You won't regret making an appointment. And if you can't get in with Joanna, you'll still be in good hands. But seriously, ask for Joanna, she's an absolute doll!"
1/14/18,0.34375,Positive,0,5.0 star rating,"Absolutely love this place ! It was my first time. had an appointment with Justine, she did a balayage on me before that I've never done anything to my hair at all. And I have to say I'm absolutely in love with it  everyone should definitely go to Justine to get there hair done !"
11/2/16,-0.14775641,Negative,1,1.0 star rating,"It's too bad you can't give no stars. Posting this on behalf of my wife. As a husband to see your wife come home a wreck because she was so sad about her haircut is a terrible thing. Now for her words not mine- Was able to get appt quickly - but was asked to reschedule an hour before arrival to the next day. The next day, was asked to come in early b.c. someone else cancelled.   when asked what i wanted - a very small trim.... trying to grow it out. was specific about no layers, no face framing etc. just a basic length 1/4 inch trim on the length. she proposed layers - i said no... and affirmatively confirmed  back no layers. seemed like we were on the same page. then she began cutting.... she cut long layers into my hair (on one side of my head only...?) and i lost the length i had been trying to grow out literally for years. my directions could not have been clearer - she simply did what SHE wanted. she caused me a huge setback and i could not be more disappointed. this stylist doesn't not listen to the client. do not trust her. Worst part is my wife texted this girl telling her how disappointed she was and the stylist never text back. Not even a ""sorry"" or anything. That's NOT 5-star service. However, clearly this salon had an all 5-star rating so YMMV"
8/11/17,0.303246753,Positive,0,5.0 star rating,"Got my hair cut and styled yesterday from Rio she new exactly what I wanted and needed my hair looks amazing. Love the ambiance of this salon, everything top notch. I am a new regular of Rio Nichols."
12/24/17,0.289880952,Positive,0,5.0 star rating,"This studio is filled with vibrant energy. The decor is chic and the stylists are super friendly. You can't help but notice how well all the stylist get along and that energy just rubs off on you. The stylist that attended me, Justine, was super attentive and patient. Not only that but she really enjoys what she does and that is shown in her work. I was absolutely thrilled with the end results. All along the way she was willing to change things if I wasn't satisfied with how my hair was coming out. I could not ask for better service. I'm definitely going back again."
6/2/17,0.255555556,Positive,0,4.5 star rating,I get my hair cut by Ally. She does amazing work. Super friendly and funny and works hard to make sure I am happy with my hair. She has even spent some extra time showing me specific ways to style my hair so I could do it on my own. I will keep coming back. Thank you ally!!!
8/30/17,0.6375,Positive,0,4.5 star rating,For Sarah R. If your looking for a miracle-worker; come here. All the ladies are amazing but the greatest of them all is Sarah R. True transformation at its finest with amazing customer service. Stop by and check it out.
11/19/16,0.304254526,Positive,0,1.0 star rating,"This was my first visit to this salon and it won't be my last! My last stylist left for maternity leave and never came back, so it had been some time since I had trusted my hair in the hands of someone new. Kirsten B works wonders!!!! I came in with a few pictures and a single idea of what I wanted done: little to no trimming, color correction, ombré and layers. The final result- exactly what I asked for and more! The salon- beautiful! From the festive decor, to the product display, to the open stations and to top it off the luxurious interior decor and design! They even offered me snacks and beverages during my pampering and treatments... I felt like royalty :) My appt was about 1 week prior to my wedding and I couldn't have been more happy with my hair... So happy I asked Kirsten to style my hair for my wedding day too! I've found my new stylist and I couldn't be more thrilled! Thank you Kirsten!"
7/11/17,1,Positive,0,5.0 star rating,Everything about this place was excellent! Customer service to the hair professionals. Thank you!
7/3/17,0.24,Positive,0,5.0 star rating,"After going to multiple hairdressers over the years, I finally found my go to girl! Katie does an amazing job with my hair and I always get compliments on the amazing color she does. I will definitely be referring her to all my friends."
12/5/16,0.281208791,Positive,0,5.0 star rating,"Decided to do something completely different, a lot lighter than usual. Have to admit it was I wasn't quite sure what I was getting myself into; but thanks to Justine & Kean amazing skills I have accomplished the color and look I've been wanting. Justine is very attentive and keen to her clients needs. Glad I took my sisters advice, made the experience enjoyable. Amazing color skills, she will work to get it just right. Definitely coming back."
10/1/17,0.142121212,Positive,0,1.0 star rating,"Not a good experience.  When I made my appointment, I asked for a stylist who could give me a men's scissor cut.  Instead, I got a lawnmower-style buzz cut.  The only positive thing about this haircut is that my hair grows quickly and it will look better in 3 weeks."
6/13/17,0.284940476,Positive,0,5.0 star rating,"I got my cut hair by Rio and definitely best experience ever! Not only is Rio is super experience but she has hair styling in her blood. She knew exactly how I wanted to cut my hair and she knows how to cut bangs too! Most hair stylist said they know how it I always end up with too short or too long uneven cut. I highly recommend Rio, she's super sweet, experienced, and up to date with the hottest trend! Will definitely go to her for my haircut from now on. To end it all it was very affordable!"
12/11/17,0.416666667,Positive,0,4.0 star rating,So glad I found this place! I took my daughter and we both got a cut & color  it looks fabulous!! And the price is affordable. My only regret is I wish I found this place sooner.
