Date,SentimentScore,Sentiment,SentimentNum,StarRating,Review
3/14/15,0.344444444,Positive,0,4.5 star rating,"The lady who answered the phones was really nice and friendly, and scheduled me with Katie B. who I absolutely fell in love with! She gave me such a great hair cut and made my whole experience really fun, I don't think I stopped laughing. Because of her I will definitely go back."
8/24/15,0.484090909,Positive,0,5.0 star rating,"Brought my teen-aged daughter to Katie who did an AMAZING job. My daughter wanted to shave part of her beautiful long hair which I thought would break my heart. But Katie made it look awesome! She even styled my daughter's hair so she could ""go punk"" when she wants and be more conservative other times. My daughter and I couldn't be more pleased. I'm so glad my daughter got what she wanted and we found Katie to make it look beautiful."
2/19/14,0.373051948,Positive,0,5.0 star rating,"Silvia is the most amazing hair stylist ever.  She makes my hair look gorgeous.  She cuts it perfectly, even when I am so vague in what I want, somehow she translates it.  The entire shop is gorgeous, the staff is friendly.  I LOVE this place.  Worth every single dollar."
1/14/13,0.082120811,Positive,0,1.0 star rating,"I'm not the type to leave negative reviews (If you look, all my reviews are almost all 5 stars) but I felt the need to warn people about my experience at studio fifty fifty. I was celebrating my birthday at a big birthday dinner with 20+ people, and I decided to treat myself to a wash and style, so I can have beautiful curls for the birthday dinner. I called Studio Fifty Fifty and they told me they could get me in that afternoon and it would be $35.00. I decided to go for it. At first when I pulled into the parking lot I was having reservations, the salon is located right next to a dive bar, and there were two drunk guys in the parking lot talking loudly and stumbling around (I was afraid they were going to drive and might back into my car...the parking lot is small). When I went into the salon it was BEAUTIFUL!! I was very impressed by the decor! I waited about 10 minutes past my appointment time for my stylist. When she came to greet me she said ""I heard its your birthday"" I said yes, as we were walking towards the shampoo bowl. Some other stylists over heard our conversation and wished me a happy birthday. I was on cloud 9, I left so pampered and loved on my birthday. This is where it went down hill. As the stylist was shampooing my hair, she kept burping and excusing herself. Once we got back to her chair, she put a towel on my head to dry it, and then grabbed her stomach and said ""excuse me"" She was gone a good five minutes, and then returned and told me she had just gotten sick to her stomach. Of course I was concerned for her health, but I also didn't want to get sick on my birthday (I had a trip to Vegas planned that weekend). She started blow drying my hair, and kept telling me how sick she was. She had to excuse herself two more times to ""throw up""  Finally my hair was done and it looked NOTHING like the picture I gave her. I told her it wasn't what I wanted, and she told me that by the time I get to dinner my curls would ""fall"" and look more like the photo. I was livid, if someone is sitting in your chair telling you they aren't happy with the results, you fix it, you don't send them on their way and tell them it will get better. She didn't fix it (probably because she was sick) but the salon should have had someone else step in for her. I literally cried on the way home, my hair would have looked better if I just did it myself at home. I was 30 minutes late to my birthday because I was trying to flat iron and re-curl my hair myself. I will never return to this salon, please be cautious when coming here."
12/1/13,0.368482143,Positive,0,5.0 star rating,"I got my second haircut from Hannah at Studio 50/50, and I'll be getting many more.  She has a nice feel for men's hair, seems to know exactly what to do.  She's also very nice, easy to talk to, and charges very reasonably.The studio itself is very cool! Hip decor, cool music, and spacious.  Also very clean.  I'd been looking for a regular place to go to every 2 1/2 weeks, and I'm glad to have found it.  Definitely recommend Hannah and Studio 50/50."
6/11/13,0.259126984,Positive,0,5.0 star rating,"I have been going to the same salon for over 10 years and I met the owners Silvanna & Diane and I just had to try the place out. The Salon is full of energy and has an awesome feel to it. Silvanna gave me a great haircut and made me feel special the whole time I was there. My expereince was first class and would totally recommend trying them out, you wont be sorry!"
1/7/11,0.359281608,Positive,0,5.0 star rating,"I have been going to Joanna for my hair for a few years now...She recently relocated to Studio Fifty Fifty and I love the new salon!!! First about Joanna- She is a great stylist. Very professional and listens to what I want. She tries to accomidate me as much as she can but is also realistic about what my hair can and can not do. I appreciate the fact that she is interested not only in my hair looking good, but also the health of my hair! I always leave her chair feeling great about my hair and of course, looking amazing!!!The salon- I love love love the new place! It was completely redone when they moved in and its gorgeous!!! The receptionist is very attentive and greeted me right when I walked in the door (very professional). She let Joanna know I was there right away. Every stylist in the salon was very professional and helpful. It seemed like they were all working as a team there even though everyone works independently. The prices are reasonable...not cheap but also not overpriced. And ladies know, when it comes to hair, you get what you pay for! Dont skimp in this department! I would recommend Studio Fifty Fifty to all my friends....go see JOANNA!!! She is the best!!!"
1/9/14,0.389607921,Positive,0,5.0 star rating,"MY Stylist ** Robert** AMAZING!!  In every way...Don't know what you need, HE DOES... My Mop was a MESS when I first went to Robert, then he worked his magic and .I have never been more pleased with my COLOR or the CONDITION of my hair. I love the atmosphere of the Salon, Very Clean, Upbeat, and Super Friendly from the Moment you walk in the door. Robert has taught me a lot of ""what not to do's"" with my hair that none of my other stylists EVER bothered to share with me. Also, he has recommended Great Products that helped repair my over processed mess. Hands Down, he is the BEST ! and the Cake Topper Super Fun Personality, Positive and I must add  Beautiful to look at ....EVERY time I leave there I feel like A Million Bucks!"
2/9/14,0.157302189,Positive,0,5.0 star rating,"I've been meaning to write this review for the past couple of months but now I have time to sit down and collect my thoughts. My boyfriend purchased a Groupon as an early Christmas gift so I made an appointment and went in for a cut, root touch-up and partial highlights with Andrea Borhegyi sometime in mid December. My previous stylist had moved back to the east coast so I was in search of a new stylist, and alas, I was definitely not disappointed! Andrea was friendly and I felt like she gave me her honest opinion when I asked for advice on color and length. I ended cutting about 4-5 inches off, which I was hesitant about at first, but ended up loving it! My  cut and style was glamorous, the root touch up matched my existing color and my highlights were great because they turned out more blond, which highlighted my face! I can't wait to go back! Thanks to Andrea B., I have found a new stylist! :)"
7/28/13,0.32,Positive,0,5.0 star rating,"Amazing place, Andrea gives awsome haircuts and color. Guy or Girl I highly suggest going here, I even drive a distance to come here for the fantastic service and quality. Everyone there is extremely friendly and curtious to all of the customers. Very cool atmosphere and vibe of the entire place highly recommend Andrea!!"
1/17/14,0.4875,Positive,0,5.0 star rating,"I have been to this salon a few times, but my latest experience inspiried me to write this review.  Eddie made me feel like a million bucks!  i love love love my hair.  Eddie does great blondes!"
5/15/13,0.157142857,Positive,0,5.0 star rating,Came here with a group on AD after doing a little searching . I have only had $5 hair cuts from Marinello but I wanted full blonde highlights and I don't trust Marinello so much for those :p anyways I was given Hannah and she is amazing !! I have already come back for my second treatment (going from dark brown ) and look forward to coming back in 2 months for another one . Yes it's expensive but for the value it's worth every penny :)
2/25/13,0.505555556,Positive,0,5.0 star rating,Hanna has made my hair look even better than my previous salon where I was paying more.  My hair is looking healthier too.  Best of all great service.  Enjoy the atmosphere.
3/24/14,0.252335859,Positive,0,5.0 star rating,"I live in Phoenix but I'm originally from Huntington Beach and over the holidays I was in town visiting family. In desperate need of haircut, I asked my sister if she knew of any quality salons to get my hair cut at. She recommended that I go to Studio Fifty Fifty and ask for Katie Brunner. That's exactly what I did. Katie is definitely an artist. You can tell by the way she works her hands and listens to you. I've seriously never had anybody cut my hair exactly how I want it and I'm very picky when it comes to my hair. Also, not only is she amazing with hair but she's very interesting to talk to and will crack you up. I'll be growing my hair out for summertime when I come to visit just to get my hair cut again by Katie. I'm very impressed! Go see Katie!"
6/8/15,0.273609138,Positive,0,5.0 star rating,I have been looking for a new local stylist that I like and after searching for what feels like forever I have finally found her!! Ashley Sue does amazing work! I came to her for a cut and color and wanted to try something new! She gave me a great sassy A line Bob and fresh new color! She was very personable and all around pleasant. We have so much in common I feel like I have met a long lost BFF! Im excited to come to her for all my beauty needs! This girl knows whats up!! I highly recommend booking with her ASAP!
12/25/14,-0.15625,Negative,1,1.0 star rating,Avoid Sarah Mulqueen. Save your time and money. Bad customer service. Did not listen to what I wanted done to my hair... I was so unhappy with the result. I called the salon immediately to try to get this fixed. The receptionist at the salon was so helpful and kind explaining my options. She left a message for Sarah to return my call. NO CALL BACK. Terrible customer service. HUGE waste of money. I was so unhappy with my hair I went to another salon in the same week to have it fixed!
12/19/13,0.258583333,Positive,0,5.0 star rating,"I have spent far too long looking for a super stylist. There seem to be many more mediocre stylists out there than there are great ones, and I have finally found a great one!  SYLVIA is a true expert; my color is exactly what I thought only magic could bring me!  The entire salon has a very cool and somewhat edgy (not in a low-rent way) vibe and Sylvia is an A-level Stylist. I literally teared up when she achieved what she did with my hair and had to compose myself to make my dinner date. Also, the girl at the reception is super fabulous! Friendly and accommodating on the phone as well as in person. I have found my hair home."
7/28/13,0.45,Positive,0,5.0 star rating,Andrea is the bomb when it comes to getting your hair did properly and talking about a great atmosphere and the hottest stylists around  they got it. Check out Andrea's instagram for her latest majic on my hair love the place
1/29/15,0.121704545,Positive,0,5.0 star rating,"I have been going to Eddie for about 3 years now, so I followed him when he changed salons to Studio Fifty Fifty. I always get great service every time, and I go in every three to four months. I get almost the same thing done each time (sometimes I vary the coloring a bit), which is highlights, lowlights, a base bump and a trim. I have very long hair so sometimes it is difficult to color, but Eddie does wonderful work every time. He always makes sure not to take too much off, as I like keeping it long, but does a great job with layering it each time. The color always turns out to what I describe exactly, which is a major reason I keep going back. I bought a Groupon once for a color and cut, and was so disappointed with what they did I went to Eddie within 2 weeks to have him fix it. (They turned me BLONDE, which is not what I asked for as I am a brunette, and my hair was slanted on the bottom from them cutting it poorly). Eddie had me fixed up and didn't charge me a full service price, which was very nice if him. I would recommend Eddie at Studio Fifty Fifty for anyone who cares about their hair and likes great service at a reasonable price."
5/25/15,0.666,Positive,0,4.5 star rating,Great place great stylists.  Nancy is the best for color and cut.  Nice decor very classy never go anywhere else
9/20/13,0.5725,Positive,0,4.5 star rating,Andrea is great! Highly recommend her for hair cuts and colors. She gave me very natural looking sun kissed highlights and an awesome hair cut.
1/7/14,0.413650794,Positive,0,5.0 star rating,"I loved my experience at this salon. I used an offer from Groupon for the haircut only. My stylist was Andrea and she was super friendly and very attentive. I showed her a picture of the haircut that I wanted and I love the way it turned out. She made sure I had the perfect haircut and was happy with it. My hair feels so full, healthy and I love to style it everyday.  The stylist took about 40 minutes to take care of my hair and not just a quick 10 minute cut to get you out of the door; this is what sets it apart from so many other salons and makes it worthwhile to visit them again. Thank you Andrea for giving me such a great haircut and a fresh look, I love it and will be returning soon."
3/5/14,0.290384615,Positive,0,5.0 star rating,Ally! So thankful Ally's back in town!! My hair has been missing her since she moved to Hollywood to become a fancy stylist to the stars and share her talent on TV. So glad she's finally home and in this adorable salon. Great atmosphere and friendly staff only add to a wonderful experience. She gave me a great cut and color with highlights. Her talents have only blossomed since the last time she did my hair and now I don't have to trek up the 405!! I'll be back soon for a Brazilian blowout. xoxo
2/24/14,0.176789322,Positive,0,5.0 star rating,"DYANNA IS AN EXPERT AT WHAT SHE DOES!! I had been going to a salon for years. I have always used my hair dark and decided to try the ombre in lighter shades. What this lady at my previous salon did to my hair was so terrible I could not sleep at night. I had heard of Studio Fifty Fifty for a while now and decided to make an appointment with someone that could fix my hair the very next morning and spoke to Ally at Studio Fifty Fifty. Ally heard me with so much patience and gave me my time without rushing me. She recommended DYANNA who was available to help me. Boy was I placed in the right hands!  Not only did Dyanna corrected the orange and yellow color I had going on on my hair but she made it closest to the picture I had taken for inspiration. I really like my hair and although it is a process because of what had been done , I am happy now. Dyanna can work with different shades of hair and bring out the best of it so ask for her when you go, she is good and has a passion for what she does! This is now my new salon :0)    Ana"
4/16/13,0.285890947,Positive,0,5.0 star rating,"This place is a hidden gem! I needed a new stylist and salon, so I did some research on Yelp. This place had the best rating, for the right amount of $$, nearest to my home. I called and was booked with Melissa. Melissa is awesome. Super friendly, listened to what I wanted, and the results were lovely! I ended up calling her so I could come back in for extra highlights--no fault of her own, I was just not ready to go all-brunette. She was so accommodating in having me come back to add the highlights, even offering to come in early or stay late for me. I am happy to have found my new salon and stylist! This place is a must!"
3/11/15,0.328461538,Positive,0,5.0 star rating,"I recently wanted to make a change in my hair style. I always have had long hair and I wanted to do something different. I went and saw Ashley Sue at studio fifty fifty and not only was it exactly what I wanted, my color was AMAZING! She was very detailed and made sure I left there looking beautiful! I would highly recommend going to see her! By far the best hair cut/color I have ever had!"
1/23/14,0.7625,Positive,0,5.0 star rating,"Just had a color and cut by Andrea B. She is a great stylist!  The cut looked great, and the color was a perfect match for me.  I really like how she listens to what I like, gives her input and then gives me a cut that looks good on me.  Thank you Andrea for taking good care of me and your clients!"
11/16/14,0.3,Positive,0,5.0 star rating,"Katie is amazing, I have seen her recommended by a co-worker, she simply gets what you want, and I am officially hooked!    Thank you, Katie!!"
6/26/14,0.075,Positive,0,5.0 star rating,I came here to get my highlights fixed after another salon left me with weeks of outgrowth still showing and was fortunate to get Ashley as a stylist! She fixed my hair and did an amazing job! Come here and ask for Ashley- you won't be disappointed!!!
3/16/14,0.45297619,Positive,0,5.0 star rating,"I have been a client of Dyanna ""Dy"" Langlais for several years! I followed her to this salon which is a very inviting place to spend some beauty time.I always feel beautiful and happy after Dy works her magic. She has a natural instinct and does fabulous work with color. I can't even tell you how many times I got compliments from women on the street after Dy has done my do!We have our fun joke, whereby she makes me ""silky, smooth""! She even helps to find me the right person to stand in for her when she goes for a vacation or has an illness.  Make an appt with Dy today. You will be happy with the results!"
10/29/13,0.275,Positive,0,5.0 star rating,"Do yourself a favor and book an appointment with Andrea!  She's done my hair multiple times and I've loved it every time!  I've had all over color, low lights, or just a touch up.  And whether she's trimming my hair or cutting off a significant amount, its always turned out great.  She's a master at her craft!"
8/25/13,0.5875,Positive,0,1.0 star rating,"Got the best haircut of my life from Heather Sanchez! She's SO nice and truly listens to what you want. If you want to LOVE your hair, go see Heather. No but seriously..right now;)"
7/12/12,0.339366391,Positive,0,5.0 star rating,"Heather is an amazing stylist there, every time she cuts and colors my hair it is a work of art! Heather has an eye for cut and style that would look great on the person. The shape I'm always happy with and it lasts for months, The coloring is very natural but gives that umph to the hair. Everytime I go to her I always receive compliments on my hair for months, it always look fresh and new.  The ambiance of the salon is clean, cutting edge and comfortable. The coffee is yummy and a good plethora of magazines to choose from to help for those long sessions."
6/30/11,0.171412037,Positive,0,5.0 star rating,"I love this place for three reasons!One - Kimberly is awesome! Somehow she manages to make my super thick and crazy hair manageable and still funky. My hair is just above my shoulders and so thick that it often is poofy and weird if I don't straighten it. The other day Kim cut it so it flows together and taught me the best way to dry it, and I did it myself! I didn't even use my flat iron today and I received compliments on my hair! :DTwo - Everyone is so nice! Other hair stylists that walked by while Kimberly was doing my hair stopped and complimented my hair and were just really friendly.Three - The place just looks awesome. Clean, fairly big, and well decorated."
5/12/14,0.252741121,Positive,0,5.0 star rating,"This is an overdue review (sorry! got a haircut last month) is for John Laursen.  I'm always on the lookout for a new hair salon because out of all the 10 or 20 salons I've been too I never walked out genuinely happy. Luckily I discovered Studio Fifty Fifty through Groupon and can say I walked out very satisfied and look forward to coming again. The Groupon deal came with a haircut and all-over hair color but John was nice enough to give me something better. Instead I got awesome highlights that goes with my skin tone perfectly and gives me some edge! He didn't do anything too drastic, which is great because I didn't want blonde highlights or a color that made me look old. Basically he toned down my natural hair color and added the highlights. Also, he evened out my old asymmetrical haircut very well and added layers that made the highlights stand out. John was very friendly and courteous towards me. He's not like other hair stylists where they'll be silent during the cutting process, do something completely different than what you want, or suggest something and then do something else. John knew how to connect with me, it was easy to talk to him. I honestly came into the salon not really knowing what I wanted. John showed me pictures and gave descriptive suggestions for what I could do with my hair. I get so many compliments about my hair and questions on where I got my haircut. I definitely have spread the word and will be back when I need a haircut or color touch up. :)"
7/26/12,0.230523744,Positive,0,5.0 star rating,"I just moved to HB and I needed an emergency bang trim. I saw all the great reviews on yelp so I decided to walk in since it was only a block down from my house. They set me up with Diana right away and she did an amazing job!!! :) I'm very picky about my bangs since I've had horrible cuts in the past, so I was nervous to try out a new salon. I thought I would probably need to test out a few salons in the area before i found ""the one."" But nope, this is definitely it! I'm so happy with the cut and I can tell the entire staff is very professional. Best part of it all, Diana didn't even charge me :) She said bang trims are complimentary since people need them so often! I gave her a $10 tip and I'm definitely coming back for my next cut. I'm also scheduling an appointment for some highlights because I loved Diana's wispy, caramel highlights so much!"
11/25/13,0.5735,Positive,0,5.0 star rating,"I see Hannah Perry, she's great I always leave feeling like I just had the best treatment there is to get...she is very professional and even better at what she does!  I would highly recommend her for anyone needing anything done!!!"
8/7/13,0.427083333,Positive,0,5.0 star rating,Been going to see Andrea Borhegyi for years now...she always does a great job cutting my hair and really listens to what I ask her for.  She has great technique and really knows how to cut my fine hair to maximize it's volume.   Beautiful salon with nice ambience!
12/4/12,0.384375,Positive,0,5.0 star rating,"I have been getting my hair done by Silvia N. for YEARS now and have never disliked it. Whether she does a cut, color, style or extensions I always love the results. I've referred 5 people to her who have all felt exactly the same after seeing my hair. The salon is a great atmosphere, fun and enjoyable to be there. Not to mention getting to drink while getting pretty-fied :) I won't be going anywhere else or to anyone else any time soon!"
7/30/13,0.46,Positive,0,4.5 star rating,"I made an appointment with Chris Escobosa to do my step daughters hair and makeup for her senior class pictures.  He was professional fast and went beyond the specifications that my stepdaughter had given him.  Her hair looked fantastic and her makeup was flawless.  The pictures came out amazing and my step daughter is looking forward to having Chris do her hair and makeup for Home Coming, Winter Formal and Prom."
9/19/13,0.365,Positive,0,4.5 star rating,Go see Sylvia!!! I went here for my first ever eyebrow wax and she was amazing! I've always been scared of getting my brows waxed because I already have thin brows but she kept them full and shaped them perfectly! Loved her!
1/30/15,0.648333333,Positive,0,5.0 star rating,I love this salon. always clean. friendly staff and Eddie G is the best !! perfect hair every time !
4/16/14,0.1759375,Positive,0,5.0 star rating,"Sorry this review took so long to go up! I've seen Andrea B at 50-50 twice now, first for full color & cut, then again for color touch up and Brazilian Blowout - and I'm just about to call & make my next appt. Andrea is fantastic, she listened and created the PERFECT coppery auburn for my hair. She's also just fun to talk to and my whole salon experience is relaxing and fun (instead of long & boring). I originally found Andrea on Groupon, saw she had good reviews, and I haven't looked back since. Pay no attention to the profile photo of my hair - that was pre-Andrea. I'll update as soon as I get my hair done again. I HIGHLY recommend Andrea. But, to be fair, I would also tell her to have more confidence in her artistry - another reviewer mentioned that Andrea kept asking her throughout the haircut if it was looking okay, and I had a similar experience. Andrea, dear, you do FABULOUS work, so you don't need to be nervous or overly concerned that your client will hate it. Love my hair every time I leave the salon and get tons of compliments. Can't wait to get back to the salon!"
